{
  "schema": "servicenow-result/v1",
  "request_id": "req-inc-bgp-adj-20260812-001",
  "correlation_id": "network-fault-001",
  "completed_at": "2026-08-12T18:06:14Z",
  "status": "succeeded",
  "action": "created",
  "record": {
    "type": "incident",
    "number": "INC0001001",
    "sys_id": "00000000000000000000000000000001",
    "state": "New",
    "updated_at": "2026-08-12T18:06:11Z",
    "url": null
  },
  "verification": {
    "read_back": true,
    "matched_request": true,
    "verified_fields": [
      "number",
      "sys_id",
      "state",
      "short_description",
      "urgency",
      "impact",
      "category",
      "automation_marker"
    ]
  },
  "source_refs": [
    "state/health.json"
  ],
  "error": null
}
